{
  "schema": 1,
  "createdAt": "2026-10-20T19:15:02Z",
  "source": {
    "location": "https://github.com/omichelsen/compare-versions.git",
    "path": ".porter/cache/source",
    "ref": "v6.1.1",
    "commit": "497a7e0c5fc00c6bb16f3aa81ce32fe2acdd43cd",
    "dirty": false,
    "subpath": null,
    "language": "typescript",
    "package": {
      "name": "compare-versions",
      "version": "6.1.1"
    },
    "license": {
      "spdx": "MIT",
      "copyleft": "none"
    },
    "mode": "code",
    "authorization": null
  },
  "target": {
    "language": "rust",
    "path": ".",
    "package": "compare-versions-port"
  },
  "options": {
    "commitPolicy": "per-unit",
    "worktree": false,
    "registryTtlHours": 24,
    "budgets": {
      "unitMaxLoc": 400,
      "unitMaxSymbols": 8,
      "unitMinLoc": 30,
      "attemptsPerUnit": 3,
      "discoveredUnits": 5,
      "portMaxDepth": 1,
      "portMaxLoc": 2000
    }
  }
}
