{
  "schema": 1,
  "createdAt": "2026-10-20T16:27:49Z",
  "source": {
    "location": "https://github.com/vercel/ms.git",
    "path": ".porter/cache/source",
    "ref": "2.1.3",
    "commit": "1c6264b795492e8fdecbc82cb8802fcfbfc08d26",
    "dirty": false,
    "subpath": null,
    "language": "javascript",
    "package": {
      "name": "ms",
      "version": "2.1.3"
    },
    "license": {
      "spdx": "MIT",
      "copyleft": "none"
    },
    "mode": "code",
    "authorization": null
  },
  "target": {
    "language": "go",
    "path": ".",
    "package": "github.com/agentporter-examples/ms"
  },
  "options": {
    "commitPolicy": "per-unit",
    "worktree": false,
    "registryTtlHours": 24,
    "budgets": {
      "unitMaxLoc": 400,
      "unitMaxSymbols": 8,
      "unitMinLoc": 30,
      "attemptsPerUnit": 3,
      "discoveredUnits": 5,
      "portMaxDepth": 1,
      "portMaxLoc": 2000
    }
  }
}
